[
  {
    "project_id": "PJT-001",
    "record_id": "PJT-001-QA-001",
    "generation_status": "GENERATED",
    "approval_status": "PENDING",
    "step_id": "STEP_09_QA_BUILD",
    "qa_no": 1,
    "related_version": "full",
    "qa_type": "comprehension",
    "question": "桃の中から何が出てきたかな？",
    "answer_short": "男の子",
    "answer_narration": "大きな桃をわると、中から元気な男の子が飛び出してきたよ。おじいさんとおばあさんはびっくりして、この子を桃太郎と名付けたんだ。",
    "subtitle": "桃から生まれた子",
    "card_visual": "",
    "duration_sec": "",
    "learning_goal": "",
    "updated_at": "2026-04-12T10:00:00.000Z",
    "updated_by": "github_actions",
    "notes": ""
  },
  {
    "project_id": "PJT-001",
    "record_id": "PJT-001-QA-002",
    "generation_status": "GENERATED",
    "approval_status": "PENDING",
    "step_id": "STEP_09_QA_BUILD",
    "qa_no": 2,
    "related_version": "full",
    "qa_type": "emotion",
    "question": "おばあさんは桃を見つけたとき、どんな気持ちだったと思う？",
    "answer_short": "びっくりした気持ち",
    "answer_narration": "川にこんなに大きな桃が流れてきたから、おばあさんはとても驚いたね。うれしくてドキドキした気持ちもあったかもしれないよ。",
    "subtitle": "おばあさんの気持ち",
    "card_visual": "",
    "duration_sec": "",
    "learning_goal": "",
    "updated_at": "2026-04-12T10:00:00.000Z",
    "updated_by": "github_actions",
    "notes": ""
  },
  {
    "project_id": "PJT-001",
    "record_id": "PJT-001-QA-011",
    "generation_status": "GENERATED",
    "approval_status": "PENDING",
    "step_id": "STEP_09_QA_BUILD",
    "qa_no": 1,
    "related_version": "short",
    "qa_type": "comprehension",
    "question": "桃の中から何が出てきたかな？",
    "answer_short": "男の子",
    "answer_narration": "大きな桃をわると、中から元気な男の子が飛び出してきたよ。おじいさんとおばあさんはびっくりして、この子を桃太郎と名付けたんだ。",
    "subtitle": "桃から生まれた子",
    "card_visual": "",
    "duration_sec": "",
    "learning_goal": "",
    "updated_at": "2026-04-12T10:00:00.000Z",
    "updated_by": "github_actions",
    "notes": ""
  }
]
